{
  "schema_version": 1,
  "suite": "import",
  "skills_root": "skills",
  "included_skills": ["content-video-editor", "designer", "video-director"],
  "case_files": [
    "fixtures/evals/cases/content-video-editor.json",
    "fixtures/evals/cases/designer.json",
    "fixtures/evals/cases/video-director.json"
  ],
  "workspace_eval_sources": [
    "tools/skills/ads/evals/evals.json",
    "tools/skills/architect/evals/evals.json",
    "tools/skills/brand-identity/evals/evals.json",
    "tools/skills/brand/evals/evals.json",
    "tools/skills/coder/evals/evals.json",
    "tools/skills/commit/evals/evals.json",
    "tools/skills/content/evals/evals.json",
    "tools/skills/content/specialists/image-enhancement/evals/evals.json",
    "tools/skills/content/specialists/kdp/evals/evals.json",
    "tools/skills/content/specialists/remotion/evals/evals.json",
    "tools/skills/content/specialists/seedance/evals/evals.json",
    "tools/skills/content/specialists/transcription/evals/evals.json",
    "tools/skills/cortex/evals/evals.json",
    "tools/skills/council/evals/evals.json",
    "tools/skills/debugger/evals/evals.json",
    "tools/skills/designer/evals/evals.json",
    "tools/skills/designer/specialists/static-creative/evals/evals.json",
    "tools/skills/dispatch/evals/evals.json",
    "tools/skills/handoff/evals/evals.json",
    "tools/skills/jfdi/evals/evals.json",
    "tools/skills/marketing/evals/evals.json",
    "tools/skills/marketing/specialists/cro/evals/evals.json",
    "tools/skills/marketing/specialists/daily-mvp/evals/evals.json",
    "tools/skills/marketing/specialists/growth/evals/evals.json",
    "tools/skills/marketing/specialists/growth/references/ab-test/evals/evals.json",
    "tools/skills/marketing/specialists/growth/references/analytics/evals/evals.json",
    "tools/skills/marketing/specialists/growth/references/pricing/evals/evals.json",
    "tools/skills/marketing/specialists/growth/references/referral/evals/evals.json",
    "tools/skills/marketing/specialists/growth/references/revops/evals/evals.json",
    "tools/skills/marketing/specialists/growth/references/sales-enablement/evals/evals.json",
    "tools/skills/marketing/specialists/ideas/evals/evals.json",
    "tools/skills/marketing/specialists/product-context/evals/evals.json",
    "tools/skills/qa/evals/evals.json",
    "tools/skills/research/evals/evals.json",
    "tools/skills/seo/evals/evals.json",
    "tools/skills/social/evals/evals.json",
    "tools/skills/social/references/content/evals/evals.json",
    "tools/skills/tasklist/evals/evals.json",
    "tools/skills/writing/evals/evals.json",
    "tools/skills/writing/specialists/blogs/evals/evals.json",
    "tools/skills/writing/specialists/changelog/evals/evals.json",
    "tools/skills/writing/specialists/copywriting/evals/evals.json",
    "tools/skills/writing/specialists/email/evals/evals.json",
    "tools/skills/writing/specialists/email/references/sequence/evals/evals.json",
    "tools/skills/writing/specialists/profile-copy/evals/evals.json"
  ],
  "exclusions_file": "fixtures/evals/exclusions.json",
  "negative_dir": "fixtures/evals/negative"
}
